Name,Description,Latitude,Longitude,InfoURL,ImageURL
UCSB,A great university located along the California Coast,34.316929,-119.845991,"https://en.wikipedia.org/wiki/University_of_California,_Santa_Barbara",https://upload.wikimedia.org/wikipedia/commons/thumb/d/de/UCSB_University_Center_and_Storke_Tower.jpg/440px-UCSB_University_Center_and_Storke_Tower.jpg
Turtle Rock,A big turtle shell shaped hill in Irvine overlooking the city ,33.63660311,-117.815285,"https://en.wikipedia.org/wiki/Turtle_Rock,_Irvine,_California",https://i.ytimg.com/vi/xNVBRzVFqWw/maxresdefault.jpg
San Onofre Beach,A popular beach in southern San Clemente,33.37657021,-117.5683478,https://www.parks.ca.gov/?page_id=647,https://upload.wikimedia.org/wikipedia/commons/thumb/a/a5/San_Onofre_State_Beach_railroad_tracks.jpg/568px-San_Onofre_State_Beach_railroad_tracks.jpg
Colorado River in Bullhead City,A stretch of the colorado river south of Laughlin,35.120568,-114.602528,"https://en.wikipedia.org/wiki/Bullhead_City,_Arizona",https://upload.wikimedia.org/wikipedia/commons/thumb/b/ba/Bullhead_City_Arizona_4.jpg/500px-Bullhead_City_Arizona_4.jpg
Signal Hill,A hill in the middle of Long Beach overlooking the city,33.79937969,-118.1656424,"https://en.wikipedia.org/wiki/Signal_Hill,_California",https://upload.wikimedia.org/wikipedia/commons/thumb/9/92/SignalHill.jpg/500px-SignalHill.jpg
Joshua Tree,A national park east of San Bernardino,33.87749847,-115.9269189,https://en.wikipedia.org/wiki/Joshua_Tree_National_Park,https://upload.wikimedia.org/wikipedia/commons/thumb/f/f9/Joshua_Tree_-_Cyclops_%2B_Potato_Head_-_Sunrise.jpg/568px-Joshua_Tree_-_Cyclops_%2B_Potato_Head_-_Sunrise.jpg
